{
  "artifact_kind": "native_probe_capability_matrix",
  "candidates": [
    {
      "claims": {
        "amd": {"detail": "PyTorch profiler backend support is runtime and build dependent.", "status": "VERSION_DEPENDENT"},
        "buffer_loss_visibility": {"detail": "Export completeness and backend loss reporting depend on the selected Kineto activity path.", "status": "VERSION_DEPENDENT"},
        "containers": {"detail": "Works where the framework runtime and accelerator devices are available.", "status": "INFERENCE"},
        "cpu_gpu_correlation": {"detail": "Kineto traces expose framework, runtime, and supported accelerator flow relationships.", "status": "CONFIRMED_BY_PRIMARY_SOURCE"},
        "device_execution_timing": {"detail": "CUDA activities include device kernel intervals when CUDA profiling is available.", "status": "CONFIRMED_BY_PRIMARY_SOURCE"},
        "engine_coupling": {"detail": "Strongest for PyTorch and engines that expose the supported profiler controls.", "status": "CONFIRMED_BY_PRIMARY_SOURCE"},
        "graph_replay": {"detail": "Device work may appear, but graph-capture operator metadata and replay attribution depend on engine and profiler configuration.", "status": "VERSION_DEPENDENT"},
        "host_api_timing": {"detail": "CPU activities and CUDA runtime activity can be collected.", "status": "CONFIRMED_BY_PRIMARY_SOURCE"},
        "instruction_level_detail": {"detail": "Not an instruction-level programmable probe.", "status": "UNSUPPORTED"},
        "kernel_identity": {"detail": "Supported CUDA activities identify kernels in exported traces.", "status": "CONFIRMED_BY_PRIMARY_SOURCE"},
        "late_attach": {"detail": "vLLM exposes bounded start/stop controls after startup, subject to profiler setup requirements.", "status": "VERSION_DEPENDENT"},
        "linux": {"detail": "Supported through PyTorch platform builds.", "status": "CONFIRMED_BY_PRIMARY_SOURCE"},
        "macos": {"detail": "CPU and supported device activities vary; CUDA is unavailable.", "status": "VERSION_DEPENDENT"},
        "nvidia": {"detail": "CUDA profiling activities are documented.", "status": "CONFIRMED_BY_PRIMARY_SOURCE"},
        "packaging_complexity": {"detail": "No new Stormlog native binary, but framework and profiler dependencies remain substantial.", "status": "INFERENCE"},
        "privileges": {"detail": "Ordinary in-process activity profiling does not inherently require an eBPF-capable privileged agent.", "status": "INFERENCE"},
        "profiler_coexistence": {"detail": "CUPTI-backed tool coexistence is version and tool dependent and must be tested.", "status": "VERSION_DEPENDENT"},
        "runtime_coupling": {"detail": "Coupled to PyTorch/Kineto and its accelerator backend.", "status": "CONFIRMED_BY_PRIMARY_SOURCE"},
        "semantic_inference_phases": {"detail": "Available only when engine/framework annotations expose them.", "status": "VERSION_DEPENDENT"},
        "signal": {"detail": "Framework operators, CPU activities, runtime calls, kernels, and optional stack/shape/memory detail.", "status": "CONFIRMED_BY_PRIMARY_SOURCE"},
        "startup_injection": {"detail": "Not required for the ordinary in-process PyTorch profiler path.", "status": "CONFIRMED_BY_PRIMARY_SOURCE"},
        "streams": {"detail": "Supported CUDA activity traces carry stream-visible device work.", "status": "CONFIRMED_BY_PRIMARY_SOURCE"},
        "support_burden": {"detail": "Moderate because behavior follows supported framework/engine integrations.", "status": "INFERENCE"},
        "windows": {"detail": "Platform behavior follows available PyTorch profiler builds.", "status": "VERSION_DEPENDENT"}
      },
      "evidence_sources": [
        {"accessed_on": "2026-09-23", "title": "PyTorch profiler", "url": "https://docs.pytorch.org/docs/stable/profiler.html", "version_or_date": "PyTorch 2.14 documentation"}
      ],
      "id": "pytorch-kineto",
      "name": "PyTorch/Kineto",
      "unverified_assumptions": ["Stormlog workload overhead and trace completeness are unmeasured."]
    },
    {
      "claims": {
        "amd": {"detail": "vLLM documents no Proton ROCm support in the current path.", "status": "UNSUPPORTED"},
        "buffer_loss_visibility": {"detail": "The public vLLM page does not establish a Stormlog loss denominator.", "status": "UNKNOWN"},
        "containers": {"detail": "Depends on compatible vLLM, Triton, CUDA, and CUPTI availability.", "status": "INFERENCE"},
        "cpu_gpu_correlation": {"detail": "The CUPTI backend and Triton hook can associate launch metadata with GPU profiles; exact coverage is unmeasured.", "status": "VERSION_DEPENDENT"},
        "device_execution_timing": {"detail": "The current NVIDIA backend is CUPTI-based and records GPU timing.", "status": "CONFIRMED_BY_PRIMARY_SOURCE"},
        "engine_coupling": {"detail": "The tested surface is vLLM's supported profiler configuration.", "status": "CONFIRMED_BY_PRIMARY_SOURCE"},
        "graph_replay": {"detail": "Triton 3.7+ tree profiles support vLLM CUDA graph attribution when enabled around capture.", "status": "CONFIRMED_BY_PRIMARY_SOURCE"},
        "host_api_timing": {"detail": "Proton focuses on GPU profiling; host/API detail depends on data mode and hooks.", "status": "VERSION_DEPENDENT"},
        "instruction_level_detail": {"detail": "PC sampling is a separate synchronized mode and not equivalent to arbitrary programmable probes.", "status": "VERSION_DEPENDENT"},
        "kernel_identity": {"detail": "Triton launch metadata can be recorded through the Triton hook.", "status": "CONFIRMED_BY_PRIMARY_SOURCE"},
        "late_attach": {"detail": "vLLM exposes repeated start/stop profiling after server startup, with graph attribution established during capture.", "status": "CONFIRMED_BY_PRIMARY_SOURCE"},
        "linux": {"detail": "Supported in the documented NVIDIA vLLM deployment path.", "status": "CONFIRMED_BY_PRIMARY_SOURCE"},
        "macos": {"detail": "The CUDA/CUPTI backend is unavailable.", "status": "UNSUPPORTED"},
        "nvidia": {"detail": "vLLM currently supports Proton's CUPTI backend on NVIDIA.", "status": "CONFIRMED_BY_PRIMARY_SOURCE"},
        "packaging_complexity": {"detail": "Uses vLLM and Triton's supported integration rather than a Stormlog-owned native collector.", "status": "INFERENCE"},
        "privileges": {"detail": "Activity profiling is distinct from privileged Linux eBPF transport; deployed permissions remain unmeasured.", "status": "INFERENCE"},
        "profiler_coexistence": {"detail": "CUPTI subscriber and NVIDIA tool coexistence remains version dependent.", "status": "VERSION_DEPENDENT"},
        "runtime_coupling": {"detail": "Requires compatible vLLM/Triton versions; graph attribution requires Triton 3.7+.", "status": "CONFIRMED_BY_PRIMARY_SOURCE"},
        "semantic_inference_phases": {"detail": "vLLM orchestration and Triton hooks provide engine-aware context not established by a generic activity collector.", "status": "INFERENCE"},
        "signal": {"detail": "Aggregate tree or Chrome trace through vLLM's supported Proton profiler controls.", "status": "CONFIRMED_BY_PRIMARY_SOURCE"},
        "startup_injection": {"detail": "Profiler configuration is supplied at server startup; capture can start later.", "status": "CONFIRMED_BY_PRIMARY_SOURCE"},
        "streams": {"detail": "CUPTI can expose streams, but the exact Proton output contract needs experiment validation.", "status": "VERSION_DEPENDENT"},
        "support_burden": {"detail": "Lower Stormlog ownership but coupled to upstream vLLM/Triton compatibility.", "status": "INFERENCE"},
        "windows": {"detail": "Not claimed by the reviewed vLLM profiler path.", "status": "UNKNOWN"}
      },
      "evidence_sources": [
        {"accessed_on": "2026-09-23", "title": "Profiling vLLM", "url": "https://docs.vllm.ai/en/latest/contributing/profiling/", "version_or_date": "latest documentation, accessed 2026-09-23"}
      ],
      "id": "vllm-proton",
      "name": "vLLM Triton Proton",
      "unverified_assumptions": ["Whether Proton already answers every intended Stormlog question is unmeasured."]
    },
    {
      "claims": {
        "amd": {"detail": "CUPTI is NVIDIA-specific.", "status": "UNSUPPORTED"},
        "buffer_loss_visibility": {"detail": "Clients must query dropped activity records and provision buffers promptly.", "status": "CONFIRMED_BY_PRIMARY_SOURCE"},
        "containers": {"detail": "Requires compatible driver/toolkit libraries and injection or in-process initialization.", "status": "VERSION_DEPENDENT"},
        "cpu_gpu_correlation": {"detail": "Runtime/driver and GPU activity share correlation identifiers when API activity is enabled.", "status": "CONFIRMED_BY_PRIMARY_SOURCE"},
        "device_execution_timing": {"detail": "Kernel and memory activity records contain device intervals.", "status": "CONFIRMED_BY_PRIMARY_SOURCE"},
        "engine_coupling": {"detail": "Framework-independent after work reaches CUDA, but lacks inference semantics by itself.", "status": "INFERENCE"},
        "graph_replay": {"detail": "Graph, graph-node, and device-graph fields are version and record dependent.", "status": "VERSION_DEPENDENT"},
        "host_api_timing": {"detail": "Runtime and driver activity records contain host API intervals.", "status": "CONFIRMED_BY_PRIMARY_SOURCE"},
        "instruction_level_detail": {"detail": "Activity tracing is not an arbitrary instruction/value probe.", "status": "UNSUPPORTED"},
        "kernel_identity": {"detail": "Kernel activity records include kernel identity fields.", "status": "CONFIRMED_BY_PRIMARY_SOURCE"},
        "late_attach": {"detail": "Activity initialization need not precede CUDA initialization, but injection and target ownership differ by design.", "status": "VERSION_DEPENDENT"},
        "linux": {"detail": "Supported.", "status": "CONFIRMED_BY_PRIMARY_SOURCE"},
        "macos": {"detail": "Current CUPTI platform support excludes macOS.", "status": "UNSUPPORTED"},